{
  "contract_version": "1.0",
  "product": "karryam",
  "correlation_id": "11111111-1111-4111-8111-111111111111",
  "as_of": "2026-10-18T08:00:00Z",
  "freshness": "UNAVAILABLE",
  "result": null,
  "error": {
    "code": "capability_blocked",
    "message": "No owner command is enabled.",
    "retryable": false,
    "operation_id": "11111111-1111-4111-8111-111111111111"
  }
}
